repositoryOrigin;repositoryPath;repositoryBranch;scmType;repositoryLink;displayName;description;recipeType;options
github.com;openrewrite/rewrite;main;GITHUB;https://github.com/openrewrite/rewrite/blob/main;Remove redundant explicit dependency and plugin versions;;Java;"[{""name"":""groupPattern"",""displayName"":""Group"",""example"":""com.google.*"",""required"":false},{""name"":""artifactPattern"",""displayName"":""Artifact"",""example"":""guava*"",""required"":false},{""name"":""onlyIfVersionsMatch"",""displayName"":""Only if versions match"",""required"":false},{""name"":""onlyIfManagedVersionIs"",""displayName"":""Only if managed version is ..."",""valid"":[""ANY"",""EQ"",""LT"",""LTE"",""GT"",""GTE""],""required"":false},{""name"":""except"",""displayName"":""Except"",""example"":""com.jcraft:jsch"",""required"":false}]"
github.com;openrewrite/rewrite;main;GITHUB;https://github.com/openrewrite/rewrite/blob/main;Change Maven dependency classifier;Add or alter the classifier of the specified dependency.;Java;"[{""name"":""groupId"",""displayName"":""Group"",""description"":""The first part of a dependency coordinate `com.google.guava:guava:VERSION`. This can be a glob expression."",""example"":""com.google.guava""},{""name"":""artifactId"",""displayName"":""Artifact"",""description"":""The second part of a dependency coordinate `com.google.guava:guava:VERSION`. This can be a glob expression."",""example"":""guava""},{""name"":""newClassifier"",""displayName"":""New classifier"",""example"":""jar"",""required"":false},{""name"":""changeManagedDependency"",""displayName"":""Change Maven managed dependency"",""description"":""This flag can be set to explicitly change the classifier in Maven management dependency section. Default `false`."",""example"":""true"",""required"":false}]"
github.com;openrewrite/rewrite;main;GITHUB;https://github.com/openrewrite/rewrite/blob/main;Add a comment to a `Maven` dependency;Adds a comment as the first element in a `Maven` dependency.;Java;"[{""name"":""xPath"",""displayName"":""XPath"",""description"":""An XPath expression used to find matching tags."",""example"":""/project/dependencies/dependency""},{""name"":""groupId"",""displayName"":""Group"",""description"":""The first part of a dependency coordinate `com.google.guava:guava:VERSION`."",""example"":""com.google.guava""},{""name"":""artifactId"",""displayName"":""Artifact"",""description"":""The second part of a dependency coordinate `com.google.guava:guava:VERSION`."",""example"":""guava""},{""name"":""commentText"",""displayName"":""Comment text"",""description"":""The text to add as a comment.."",""example"":""This is excluded due to CVE <X> and will be removed when we upgrade the next version is available.""}]"
github.com;openrewrite/rewrite;main;GITHUB;https://github.com/openrewrite/rewrite/blob/main;Add Maven project property;;Java;"[{""name"":""key"",""displayName"":""Key"",""description"":""The name of the property key to be added."",""example"":""junit.version""},{""name"":""value"",""displayName"":""Value"",""description"":""The value of property to be added."",""example"":""4.13""},{""name"":""preserveExistingValue"",""displayName"":""Preserve existing value"",""description"":""Preserve previous value if the property already exists in the pom file."",""required"":false},{""name"":""trustParent"",""displayName"":""Trust parent POM"",""required"":false}]"
github.com;openrewrite/rewrite;main;GITHUB;https://github.com/openrewrite/rewrite/blob/main;Add Maven plugin dependencies;Adds the specified dependencies to a Maven plugin. Will not add the plugin if it does not already exist in the pom.;Java;"[{""name"":""pluginGroupId"",""displayName"":""Plugin group"",""example"":""org.openrewrite.maven""},{""name"":""pluginArtifactId"",""displayName"":""Plugin artifact"",""example"":""rewrite-maven-plugin""},{""name"":""groupId"",""displayName"":""Group"",""description"":""The group ID of the dependency to add."",""example"":""org.openrewrite.recipe""},{""name"":""artifactId"",""displayName"":""Artifact"",""description"":""The artifact ID of the dependency to add."",""example"":""org.openrewrite.recipe""},{""name"":""version"",""displayName"":""Version"",""description"":""The version of the dependency to add."",""example"":""org.openrewrite.recipe""}]"
github.com;openrewrite/rewrite;main;GITHUB;https://github.com/openrewrite/rewrite/blob/main;Change Maven managed dependency groupId, artifactId and optionally the version;Change the groupId, artifactId and optionally the version of a specified Maven managed dependency.;Java;"[{""name"":""oldGroupId"",""displayName"":""Old groupId"",""description"":""The old groupId to replace. The groupId is the first part of a managed dependency coordinate `com.google.guava:guava:VERSION`."",""example"":""org.openrewrite.recipe""},{""name"":""oldArtifactId"",""displayName"":""Old artifactId"",""description"":""The old artifactId to replace. The artifactId is the second part of a managed dependency coordinate `com.google.guava:guava:VERSION`."",""example"":""rewrite-testing-frameworks""},{""name"":""newGroupId"",""displayName"":""New groupId"",""description"":""The new groupId to use."",""example"":""corp.internal.openrewrite.recipe""},{""name"":""newArtifactId"",""displayName"":""New artifactId"",""description"":""The new artifactId to use."",""example"":""rewrite-testing-frameworks""},{""name"":""newVersion"",""displayName"":""New version"",""description"":""The new version to use."",""example"":""2.0.0"",""required"":false},{""name"":""versionPattern"",""displayName"":""Version pattern"",""example"":""-jre"",""required"":false}]"
github.com;openrewrite/rewrite;main;GITHUB;https://github.com/openrewrite/rewrite/blob/main;Manage dependencies;Make existing dependencies managed by moving their version to be specified in the dependencyManagement section of the POM.;Java;"[{""name"":""groupPattern"",""displayName"":""Group"",""example"":""com.google.*""},{""name"":""artifactPattern"",""displayName"":""Artifact"",""example"":""guava*"",""required"":false},{""name"":""addToRootPom"",""displayName"":""Add to the root POM"",""description"":""Add to the root POM where root is the eldest parent of the pom within the source set."",""required"":false},{""name"":""skipModelUpdate"",""displayName"":""Skip model updates"",""required"":false}]"
github.com;openrewrite/rewrite;main;GITHUB;https://github.com/openrewrite/rewrite/blob/main;Change Maven Project Version;;Java;"[{""name"":""groupId"",""displayName"":""Group"",""description"":""The group ID of the maven project to change its version. This can be a glob expression."",""example"":""org.openrewrite""},{""name"":""artifactId"",""displayName"":""Artifact"",""description"":""The artifact ID of the maven project to change its version. This can be a glob expression."",""example"":""*""},{""name"":""newVersion"",""displayName"":""New version"",""description"":""The new version to replace the maven project version."",""example"":""8.4.2""},{""name"":""overrideParentVersion"",""displayName"":""Override Parent Version"",""description"":""This flag can be set to explicitly override the inherited parent version. Default `false`."",""required"":false}]"
github.com;openrewrite/rewrite;main;GITHUB;https://github.com/openrewrite/rewrite/blob/main;Change Maven plugin executions;Apply the specified executions to a Maven plugin. Will not add the plugin if it does not already exist in the pom.;Java;"[{""name"":""groupId"",""displayName"":""Group"",""description"":""The first part of a dependency coordinate 'org.openrewrite.maven:rewrite-maven-plugin:VERSION'."",""example"":""org.openrewrite.maven""},{""name"":""artifactId"",""displayName"":""Artifact"",""description"":""The second part of a dependency coordinate 'org.openrewrite.maven:rewrite-maven-plugin:VERSION'."",""example"":""rewrite-maven-plugin""},{""name"":""executions"",""displayName"":""Executions"",""description"":""Plugin goal executions provided as raw XML. Supplying `null` will remove any existing executions."",""example"":""<execution><phase>validate</phase><goals><goal>dryRun</goal></goals></execution>"",""required"":false}]"
github.com;openrewrite/rewrite;main;GITHUB;https://github.com/openrewrite/rewrite/blob/main;List effective Maven repositories;;Java;"[{""name"":""useMarkers"",""displayName"":""Use markers"",""description"":""Whether to add markers for each effective Maven repository to the POM. Default `false`."",""required"":false}]"
github.com;openrewrite/rewrite;main;GITHUB;https://github.com/openrewrite/rewrite/blob/main;Effective managed dependencies;Emit the data of binary dependency relationships.;Java;[]
github.com;openrewrite/rewrite;main;GITHUB;https://github.com/openrewrite/rewrite/blob/main;Find Maven projects;Maven projects are `pom.xml` files with a `MavenResolutionResult` marker.;Java;[]
github.com;openrewrite/rewrite;main;GITHUB;https://github.com/openrewrite/rewrite/blob/main;Find Maven dependency management entry;Finds first-order dependency management entries, i.e. dependencies that are defined directly in a project.;Java;"[{""name"":""groupId"",""displayName"":""Group"",""description"":""The first part of a dependency coordinate `com.google.guava:guava:VERSION`. Supports glob."",""example"":""com.google.guava""},{""name"":""artifactId"",""displayName"":""Artifact"",""description"":""The second part of a dependency coordinate `com.google.guava:guava:VERSION`. Supports glob."",""example"":""guava""},{""name"":""version"",""displayName"":""Version"",""description"":""An exact version number or node-style semver selector used to select the version number."",""example"":""3.0.0"",""required"":false},{""name"":""versionPattern"",""displayName"":""Version pattern"",""example"":""-jre"",""required"":false}]"
github.com;openrewrite/rewrite;main;GITHUB;https://github.com/openrewrite/rewrite/blob/main;Maven parent insight;Find Maven parents matching a `groupId` and `artifactId`.;Java;"[{""name"":""groupIdPattern"",""displayName"":""Group pattern"",""description"":""Group glob pattern used to match dependencies."",""example"":""org.springframework.boot""},{""name"":""artifactIdPattern"",""displayName"":""Artifact pattern"",""description"":""Artifact glob pattern used to match dependencies."",""example"":""spring-boot-starter-*""},{""name"":""version"",""displayName"":""Version"",""example"":""1.x"",""required"":false},{""name"":""recursive"",""displayName"":""Recursive"",""description"":""Whether to search recursively through the parents. True by default."",""required"":false}]"
github.com;openrewrite/rewrite;main;GITHUB;https://github.com/openrewrite/rewrite/blob/main;Find Maven project properties;Finds the specified Maven project properties within a pom.xml.;Java;"[{""name"":""propertyPattern"",""displayName"":""Property pattern"",""description"":""Regular expression pattern used to match property tag names."",""example"":""guava.*""},{""name"":""valuePattern"",""displayName"":""Value pattern"",""description"":""Regular expression pattern used to match property values."",""example"":""28.*"",""required"":false}]"
github.com;openrewrite/rewrite;main;GITHUB;https://github.com/openrewrite/rewrite/blob/main;Find Maven plugin;Finds a Maven plugin within a pom.xml.;Java;"[{""name"":""groupId"",""displayName"":""Group"",""description"":""The first part of a dependency coordinate 'org.openrewrite.maven:rewrite-maven-plugin:VERSION'."",""example"":""org.openrewrite.maven""},{""name"":""artifactId"",""displayName"":""Artifact"",""description"":""The second part of a dependency coordinate 'org.openrewrite.maven:rewrite-maven-plugin:VERSION'."",""example"":""rewrite-maven-plugin""}]"
github.com;openrewrite/rewrite;main;GITHUB;https://github.com/openrewrite/rewrite/blob/main;Does not include Maven dependency;;Java;"[{""name"":""groupId"",""displayName"":""Group"",""description"":""The first part of a dependency coordinate `com.google.guava:guava:VERSION`. Supports glob."",""example"":""com.google.guava""},{""name"":""artifactId"",""displayName"":""Artifact"",""description"":""The second part of a dependency coordinate `com.google.guava:guava:VERSION`. Supports glob."",""example"":""guava""},{""name"":""onlyDirect"",""displayName"":""Only direct dependencies"",""description"":""Default false. If enabled, transitive dependencies will not be considered."",""required"":false,""example"":""true""},{""name"":""scope"",""displayName"":""Scope"",""description"":""Default any. If specified, only the requested scope's classpaths will be checked."",""required"":false,""valid"":[""compile"",""test"",""runtime"",""provided""],""example"":""compile""}]"
github.com;openrewrite/rewrite;main;GITHUB;https://github.com/openrewrite/rewrite/blob/main;Maven repository order;Determine the order in which dependencies will be resolved for each `pom.xml` based on its defined repositories and effective `settings.xml`.;Java;[]
github.com;openrewrite/rewrite;main;GITHUB;https://github.com/openrewrite/rewrite/blob/main;Maven dependency insight;;Java;"[{""name"":""groupIdPattern"",""displayName"":""Group pattern"",""description"":""Group glob pattern used to match dependencies."",""example"":""com.fasterxml.jackson.module""},{""name"":""artifactIdPattern"",""displayName"":""Artifact pattern"",""description"":""Artifact glob pattern used to match dependencies."",""example"":""jackson-module-*""},{""name"":""scope"",""displayName"":""Scope"",""description"":""Match dependencies with the specified scope. All scopes are searched by default."",""valid"":[""compile"",""test"",""runtime"",""provided"",""system""],""example"":""compile"",""required"":false},{""name"":""version"",""displayName"":""Version"",""example"":""1.x"",""required"":false},{""name"":""onlyDirect"",""displayName"":""Only direct"",""description"":""If enabled, transitive dependencies will not be considered. All dependencies are searched by default."",""required"":false,""example"":""true""}]"
github.com;openrewrite/rewrite;main;GITHUB;https://github.com/openrewrite/rewrite/blob/main;Effective dependencies;Emit the data of binary dependency relationships.;Java;"[{""name"":""scope"",""displayName"":""Scope"",""description"":""Match dependencies with the specified scope"",""valid"":[""compile"",""test"",""runtime"",""provided""],""example"":""compile""}]"
github.com;openrewrite/rewrite;main;GITHUB;https://github.com/openrewrite/rewrite/blob/main;Find Maven dependency;Finds first-order dependency uses, i.e. dependencies that are defined directly in a project.;Java;"[{""name"":""groupId"",""displayName"":""Group"",""description"":""The first part of a dependency coordinate `com.google.guava:guava:VERSION`. Supports glob."",""example"":""com.google.guava""},{""name"":""artifactId"",""displayName"":""Artifact"",""description"":""The second part of a dependency coordinate `com.google.guava:guava:VERSION`. Supports glob."",""example"":""guava""},{""name"":""version"",""displayName"":""Version"",""description"":""An exact version number or node-style semver selector used to select the version number."",""example"":""3.0.0"",""required"":false},{""name"":""versionPattern"",""displayName"":""Version pattern"",""example"":""-jre"",""required"":false}]"
github.com;openrewrite/rewrite;main;GITHUB;https://github.com/openrewrite/rewrite/blob/main;Find effective maven settings;List the effective maven settings file for the current project.;Java;"[{""name"":""existenceCheckOnly"",""displayName"":""Existence check only"",""description"":""Only record that a maven settings file exists; do not include its contents."",""required"":false}]"
github.com;openrewrite/rewrite;main;GITHUB;https://github.com/openrewrite/rewrite/blob/main;Add explicit `groupId` to Maven plugins;Add the default `<groupId>org.apache.maven.plugins</groupId>` to plugins for clarity.;Java;[]
github.com;openrewrite/rewrite;main;GITHUB;https://github.com/openrewrite/rewrite/blob/main;Add explicit plugin versions;Add explicit plugin versions to POMs for reproducibility, as [MNG-4173](https://issues.apache.org/jira/browse/MNG-4173) removes automatic version resolution for POM plugins.;Java;[]
github.com;openrewrite/rewrite;main;GITHUB;https://github.com/openrewrite/rewrite/blob/main;Dependency management dependencies should have a version;If they don't have a version, they can't possibly affect dependency resolution anywhere, and can be safely removed.;Java;[]
github.com;openrewrite/rewrite;main;GITHUB;https://github.com/openrewrite/rewrite/blob/main;Change Maven dependency scope;Add or alter the scope of the specified dependency.;Java;"[{""name"":""groupId"",""displayName"":""Group"",""description"":""The first part of a dependency coordinate `com.google.guava:guava:VERSION`."",""example"":""com.google.guava""},{""name"":""artifactId"",""displayName"":""Artifact"",""description"":""The second part of a dependency coordinate `com.google.guava:guava:VERSION`."",""example"":""guava""},{""name"":""newScope"",""displayName"":""New scope"",""valid"":[""compile"",""test"",""runtime"",""provided""],""example"":""compile"",""required"":false}]"
github.com;openrewrite/rewrite;main;GITHUB;https://github.com/openrewrite/rewrite/blob/main;Add Maven dependency;Add a Maven dependency to a `pom.xml` file in the correct scope based on where it is used.;Java;"[{""name"":""groupId"",""displayName"":""Group"",""description"":""The first part of a dependency coordinate `com.google.guava:guava:VERSION`."",""example"":""com.google.guava""},{""name"":""artifactId"",""displayName"":""Artifact"",""description"":""The second part of a dependency coordinate `com.google.guava:guava:VERSION`."",""example"":""guava""},{""name"":""version"",""displayName"":""Version"",""description"":""An exact version number or node-style semver selector used to select the version number."",""example"":""29.X""},{""name"":""versionPattern"",""displayName"":""Version pattern"",""example"":""-jre"",""required"":false},{""name"":""scope"",""displayName"":""Scope"",""example"":""runtime"",""valid"":[""import"",""runtime"",""provided""],""required"":false},{""name"":""releasesOnly"",""displayName"":""Releases only"",""description"":""Whether to exclude snapshots from consideration when using a semver selector"",""required"":false},{""name"":""onlyIfUsing"",""displayName"":""Only if using"",""description"":""Used to determine if the dependency will be added and in which scope it should be placed."",""example"":""org.junit.jupiter.api.*"",""required"":false},{""name"":""type"",""displayName"":""Type"",""description"":""The type of dependency to add. If omitted Maven defaults to assuming the type is \""jar\""."",""valid"":[""jar"",""pom"",""war""],""example"":""jar"",""required"":false},{""name"":""classifier"",""displayName"":""Classifier"",""description"":""A Maven classifier to add. Most commonly used to select shaded or test variants of a library"",""example"":""test"",""required"":false},{""name"":""optional"",""displayName"":""Optional"",""description"":""Set the value of the `<optional>` tag. No `<optional>` tag will be added when this is `null`."",""required"":false},{""name"":""familyPattern"",""displayName"":""Family pattern"",""example"":""com.fasterxml.jackson*"",""required"":false},{""name"":""acceptTransitive"",""displayName"":""Accept transitive"",""description"":""Default false. If enabled, the dependency will not be added if it is already on the classpath as a transitive dependency."",""example"":""true"",""required"":false}]"
github.com;openrewrite/rewrite;main;GITHUB;https://github.com/openrewrite/rewrite/blob/main;Add repository;Adds a new Maven Repository or updates a matching repository.;Java;"[{""name"":""id"",""example"":""repo-id"",""displayName"":""Repository ID"",""description"":""A unique name to describe the repository.""},{""name"":""url"",""example"":""http://myrepo.maven.com/repo"",""displayName"":""Repository URL"",""description"":""The URL of the repository.""},{""name"":""repoName"",""example"":""My Great Repo Name"",""required"":false,""displayName"":""Repository name"",""description"":""A display name for the repository.""},{""name"":""layout"",""example"":""default"",""required"":false,""displayName"":""Repository layout"",""description"":""The Maven layout of the repository.""},{""name"":""snapshotsEnabled"",""required"":false,""displayName"":""Enable snapshots"",""description"":""Snapshots from the repository are available.""},{""name"":""snapshotsChecksumPolicy"",""example"":""warn"",""required"":false,""displayName"":""Snapshots checksum policy"",""description"":""Governs whether snapshots require checksums.""},{""name"":""snapshotsUpdatePolicy"",""example"":""always"",""required"":false,""displayName"":""Snapshots update policy"",""description"":""The policy governing snapshot updating interval.""},{""name"":""releasesEnabled"",""required"":false,""displayName"":""Releases enabled"",""description"":""Releases from the repository are available""},{""name"":""releasesChecksumPolicy"",""example"":""fail"",""required"":false,""displayName"":""Releases checksum policy"",""description"":""Governs whether releases require checksums.""},{""name"":""releasesUpdatePolicy"",""example"":""never"",""required"":false,""displayName"":""Releases update policy"",""description"":""The policy governing release updating interval.""},{""name"":""type"",""displayName"":""Repository type"",""description"":""The type of repository to add."",""example"":""Repository"",""required"":false}]"
github.com;openrewrite/rewrite;main;GITHUB;https://github.com/openrewrite/rewrite/blob/main;Upgrade transitive Maven dependencies;;Java;"[{""name"":""groupId"",""displayName"":""Group"",""description"":""The first part of a dependency coordinate 'org.apache.logging.log4j:ARTIFACT_ID:VERSION'."",""example"":""org.apache.logging.log4j""},{""name"":""artifactId"",""displayName"":""Artifact"",""description"":""The second part of a dependency coordinate 'org.apache.logging.log4j:log4j-bom:VERSION'."",""example"":""log4j-bom""},{""name"":""version"",""displayName"":""Version"",""description"":""An exact version number or node-style semver selector used to select the version number."",""example"":""latest.release""},{""name"":""scope"",""displayName"":""Scope"",""description"":""An optional scope to use for the dependency management tag."",""example"":""import"",""valid"":[""import"",""runtime"",""provided"",""test""],""required"":false},{""name"":""type"",""displayName"":""Type"",""description"":""An optional type to use for the dependency management tag."",""valid"":[""jar"",""pom"",""war""],""example"":""pom"",""required"":false},{""name"":""classifier"",""displayName"":""Classifier"",""description"":""An optional classifier to use for the dependency management tag"",""example"":""test"",""required"":false},{""name"":""versionPattern"",""displayName"":""Version pattern"",""example"":""-jre"",""required"":false},{""name"":""releasesOnly"",""displayName"":""Releases only"",""description"":""Whether to exclude snapshots from consideration when using a semver selector"",""required"":false},{""name"":""onlyIfUsing"",""displayName"":""Only if using glob expression for group:artifact"",""description"":""Only add managed dependencies to projects having a dependency matching the expression."",""example"":""org.apache.logging.log4j:log4j*"",""required"":false},{""name"":""addToRootPom"",""displayName"":""Add to the root pom"",""description"":""Add to the root pom where root is the eldest parent of the pom within the source set."",""required"":false}]"
github.com;openrewrite/rewrite;main;GITHUB;https://github.com/openrewrite/rewrite/blob/main;Change Maven plugin dependencies;Applies the specified dependencies to a Maven plugin. Will not add the plugin if it does not already exist in the pom.;Java;"[{""name"":""groupId"",""displayName"":""Group"",""description"":""The first part of a dependency coordinate 'org.openrewrite.maven:rewrite-maven-plugin:VERSION'."",""example"":""org.openrewrite.maven""},{""name"":""artifactId"",""displayName"":""Artifact"",""description"":""The second part of a dependency coordinate 'org.openrewrite.maven:rewrite-maven-plugin:VERSION'."",""example"":""rewrite-maven-plugin""},{""name"":""dependencies"",""displayName"":""Dependencies"",""example"":""org.openrewrite.recipe:rewrite-spring:1.0.0, org.openrewrite.recipe:rewrite-testing-frameworks:1.0.0"",""required"":false}]"
github.com;openrewrite/rewrite;main;GITHUB;https://github.com/openrewrite/rewrite/blob/main;Order POM elements;Order POM elements according to the [recommended](http://maven.apache.org/developers/conventions/code.html#pom-code-convention) order.;Java;[]
