repositoryOrigin;repositoryPath;repositoryBranch;scmType;repositoryLink;displayName;description;recipeType;options
github.com;openrewrite/rewrite-java-dependencies;main;GITHUB;https://github.com/openrewrite/rewrite-java-dependencies/blob/main;Find and fix vulnerable dependencies;;Java;"[{""name"":""scope"",""displayName"":""Scope"",""description"":""Match dependencies with the specified scope. Default is `compile`."",""valid"":[""compile"",""test"",""runtime"",""provided""],""example"":""compile"",""required"":false},{""name"":""overrideTransitive"",""displayName"":""Override transitives"",""example"":""false"",""required"":false}]"
github.com;openrewrite/rewrite-java-dependencies;main;GITHUB;https://github.com/openrewrite/rewrite-java-dependencies/blob/main;Software bill of materials;;Java;[]
github.com;openrewrite/rewrite-java-dependencies;main;GITHUB;https://github.com/openrewrite/rewrite-java-dependencies/blob/main;Upgrade Gradle or Maven dependency versions;;Java;"[{""name"":""groupId"",""displayName"":""Group ID"",""description"":""The first part of a dependency coordinate `com.google.guava:guava:VERSION`. This can be a glob expression."",""example"":""com.fasterxml.jackson*""},{""name"":""artifactId"",""displayName"":""Artifact ID"",""description"":""The second part of a dependency coordinate `com.google.guava:guava:VERSION`. This can be a glob expression."",""example"":""jackson-module*""},{""name"":""newVersion"",""displayName"":""New version"",""description"":""An exact version number or node-style semver selector used to select the version number. "",""example"":""29.X""},{""name"":""versionPattern"",""displayName"":""Version pattern"",""example"":""-jre"",""required"":false},{""name"":""overrideManagedVersion"",""displayName"":""Override managed version"",""required"":false},{""name"":""retainVersions"",""displayName"":""Retain versions"",""example"":""com.jcraft:jsch"",""required"":false}]"
github.com;openrewrite/rewrite-java-dependencies;main;GITHUB;https://github.com/openrewrite/rewrite-java-dependencies/blob/main;Dependency insight for Gradle and Maven;;Java;"[{""name"":""groupIdPattern"",""displayName"":""Group pattern"",""description"":""Group ID glob pattern used to match dependencies."",""example"":""com.fasterxml.jackson*""},{""name"":""artifactIdPattern"",""displayName"":""Artifact pattern"",""description"":""Artifact ID glob pattern used to match dependencies."",""example"":""jackson-*""},{""name"":""version"",""displayName"":""Version"",""example"":""1.x"",""required"":false},{""name"":""scope"",""displayName"":""Scope"",""description"":""Match dependencies with the specified Maven scope. All scopes are searched by default."",""valid"":[""compile"",""test"",""runtime"",""provided"",""system""],""example"":""compile"",""required"":false}]"
github.com;openrewrite/rewrite-java-dependencies;main;GITHUB;https://github.com/openrewrite/rewrite-java-dependencies/blob/main;Remove expired suppressions;Remove expired vulnerability suppressions from `DependencyCheck` `suppression.xml` files.;Java;[]
github.com;openrewrite/rewrite-java-dependencies;main;GITHUB;https://github.com/openrewrite/rewrite-java-dependencies/blob/main;Find the oldest matching dependency version in use;;Java;"[{""name"":""groupIdPattern"",""displayName"":""Group pattern"",""description"":""Group ID glob pattern used to match dependencies."",""example"":""com.fasterxml.jackson.module""},{""name"":""artifactIdPattern"",""displayName"":""Artifact pattern"",""description"":""Artifact ID glob pattern used to match dependencies."",""example"":""jackson-module-*""},{""name"":""version"",""displayName"":""Version"",""example"":""1.x"",""required"":false}]"
github.com;openrewrite/rewrite-java-dependencies;main;GITHUB;https://github.com/openrewrite/rewrite-java-dependencies/blob/main;Add Gradle or Maven dependency;;Java;"[{""name"":""groupId"",""displayName"":""Group ID"",""description"":""The first part of a dependency coordinate `com.google.guava:guava:VERSION`."",""example"":""com.google.guava""},{""name"":""artifactId"",""displayName"":""Artifact ID"",""description"":""The second part of a dependency coordinate `com.google.guava:guava:VERSION`"",""example"":""guava""},{""name"":""version"",""displayName"":""Version"",""description"":""An exact version number or node-style semver selector used to select the version number."",""example"":""29.X"",""required"":false},{""name"":""versionPattern"",""displayName"":""Version pattern"",""example"":""-jre"",""required"":false},{""name"":""onlyIfUsing"",""displayName"":""Only if using"",""description"":""Used to determine if the dependency will be added and in which scope it should be placed."",""example"":""org.junit.jupiter.api.*"",""required"":false},{""name"":""classifier"",""displayName"":""Classifier"",""description"":""A classifier to add. Commonly used to select variants of a library."",""example"":""test"",""required"":false},{""name"":""familyPattern"",""displayName"":""Family pattern"",""example"":""com.fasterxml.jackson*"",""required"":false},{""name"":""extension"",""displayName"":""Extension"",""description"":""For Gradle only, The extension of the dependency to add. If omitted Gradle defaults to assuming the type is \""jar\""."",""example"":""jar"",""required"":false},{""name"":""configuration"",""displayName"":""Gradle configuration"",""example"":""implementation"",""required"":false},{""name"":""scope"",""displayName"":""Maven scope"",""example"":""runtime"",""valid"":[""compile"",""provided"",""runtime"",""test""],""required"":false},{""name"":""releasesOnly"",""displayName"":""Releases only"",""description"":""For Maven only, Whether to exclude snapshots from consideration when using a semver selector"",""required"":false},{""name"":""type"",""displayName"":""Type"",""description"":""For Maven only, The type of dependency to add. If omitted Maven defaults to assuming the type is \""jar\""."",""valid"":[""jar"",""pom"",""war""],""example"":""jar"",""required"":false},{""name"":""optional"",""displayName"":""Optional"",""description"":""Set the value of the `<optional>` tag. No `<optional>` tag will be added when this is `null`."",""required"":false},{""name"":""acceptTransitive"",""displayName"":""Accept transitive"",""description"":""Default false. If enabled, the dependency will not be added if it is already on the classpath as a transitive dependency."",""example"":""true"",""required"":false}]"
github.com;openrewrite/rewrite-java-dependencies;main;GITHUB;https://github.com/openrewrite/rewrite-java-dependencies/blob/main;Upgrade transitive Gradle or Maven dependencies;;Java;"[{""name"":""groupId"",""displayName"":""Group"",""description"":""The first part of a dependency coordinate 'org.apache.logging.log4j:ARTIFACT_ID:VERSION'."",""example"":""org.apache.logging.log4j""},{""name"":""artifactId"",""displayName"":""Artifact"",""description"":""The second part of a dependency coordinate 'org.apache.logging.log4j:log4j-bom:VERSION'."",""example"":""log4j-bom""},{""name"":""version"",""displayName"":""Version"",""description"":""An exact version number or node-style semver selector used to select the version number."",""example"":""latest.release""},{""name"":""scope"",""displayName"":""Scope"",""description"":""An optional scope to use for the dependency management tag. Relevant only to Maven."",""example"":""import"",""valid"":[""import"",""runtime"",""provided"",""test""],""required"":false},{""name"":""type"",""displayName"":""Type"",""description"":""An optional type to use for the dependency management tag. Relevant only to Maven builds."",""valid"":[""jar"",""pom"",""war""],""example"":""pom"",""required"":false},{""name"":""classifier"",""displayName"":""Classifier"",""description"":""An optional classifier to use for the dependency management tag. Relevant only to Maven."",""example"":""test"",""required"":false},{""name"":""versionPattern"",""displayName"":""Version pattern"",""example"":""-jre"",""required"":false},{""name"":""because"",""displayName"":""Because"",""description"":""The reason for upgrading the transitive dependency. For example, we could be responding to a vulnerability."",""required"":false,""example"":""CVE-2021-1234""},{""name"":""releasesOnly"",""displayName"":""Releases only"",""description"":""Whether to exclude snapshots from consideration when using a semver selector"",""required"":false},{""name"":""onlyIfUsing"",""displayName"":""Only if using glob expression for group:artifact"",""description"":""Only add managed dependencies to projects having a dependency matching the expression."",""example"":""org.apache.logging.log4j:log4j*"",""required"":false},{""name"":""addToRootPom"",""displayName"":""Add to the root pom"",""description"":""Add to the root pom where root is the eldest parent of the pom within the source set."",""required"":false}]"
github.com;openrewrite/rewrite-java-dependencies;main;GITHUB;https://github.com/openrewrite/rewrite-java-dependencies/blob/main;Find licenses in use in third-party dependencies;Locates and reports on all licenses in use.;Java;"[{""name"":""scope"",""displayName"":""Scope"",""description"":""Match dependencies with the specified scope"",""valid"":[""compile"",""test"",""runtime"",""provided""],""example"":""compile""},{""name"":""addMarkers"",""displayName"":""Add markers"",""description"":""Report each license transitively used by a dependency in search results."",""required"":false}]"
github.com;openrewrite/rewrite-java-dependencies;main;GITHUB;https://github.com/openrewrite/rewrite-java-dependencies/blob/main;Remove a Gradle or Maven dependency;;Java;"[{""name"":""groupId"",""displayName"":""Group ID"",""description"":""The first part of a dependency coordinate `com.google.guava:guava:VERSION`. This can be a glob expression."",""example"":""com.fasterxml.jackson*""},{""name"":""artifactId"",""displayName"":""Artifact ID"",""description"":""The second part of a dependency coordinate `com.google.guava:guava:VERSION`. This can be a glob expression."",""example"":""jackson-module*""},{""name"":""unlessUsing"",""displayName"":""Unless using"",""description"":""Do not remove if type is in use. Supports glob expressions."",""example"":""org.aspectj.lang.*"",""required"":false},{""name"":""configuration"",""displayName"":""The dependency configuration"",""description"":""The dependency configuration to remove from."",""example"":""api"",""required"":false},{""name"":""scope"",""displayName"":""Scope"",""valid"":[""compile"",""test"",""runtime"",""provided""],""example"":""compile"",""required"":false}]"
github.com;openrewrite/rewrite-java-dependencies;main;GITHUB;https://github.com/openrewrite/rewrite-java-dependencies/blob/main;Dependency resolution diagnostic;;Java;"[{""name"":""groupId"",""displayName"":""Group ID"",""example"":""com.fasterxml.jackson.core"",""required"":false},{""name"":""artifactId"",""displayName"":""Artifact ID"",""example"":""jackson-core"",""required"":false},{""name"":""version"",""displayName"":""Version"",""example"":""2.16.0"",""required"":false}]"
github.com;openrewrite/rewrite-java-dependencies;main;GITHUB;https://github.com/openrewrite/rewrite-java-dependencies/blob/main;Find and fix vulnerable Nuget dependencies;;Java;"[{""name"":""addMarkers"",""displayName"":""Add search markers"",""required"":false}]"
github.com;openrewrite/rewrite-java-dependencies;main;GITHUB;https://github.com/openrewrite/rewrite-java-dependencies/blob/main;Upgrade C# dependency versions;Upgrades dependencies in `*.csproj` and `packages.config`.;Java;"[{""name"":""packagePattern"",""displayName"":""Package pattern"",""description"":""Package glob pattern used to match dependencies."",""example"":""Microsoft*""},{""name"":""newVersion"",""displayName"":""New version"",""description"":""An exact version number."",""example"":""12.3""}]"
github.com;openrewrite/rewrite-java-dependencies;main;GITHUB;https://github.com/openrewrite/rewrite-java-dependencies/blob/main;Dependency insight for C#;Finds dependencies in `*.csproj` and `packages.config`.;Java;"[{""name"":""packagePattern"",""displayName"":""Package pattern"",""description"":""Package glob pattern used to match dependencies."",""example"":""Microsoft*"",""required"":false},{""name"":""version"",""displayName"":""Version"",""example"":""1.x"",""required"":false}]"
github.com;openrewrite/rewrite-java-security;main;GITHUB;https://github.com/openrewrite/rewrite-java-security/blob/main;Insecure cookies;;Java;[]
github.com;openrewrite/rewrite-java-security;main;GITHUB;https://github.com/openrewrite/rewrite-java-security/blob/main;Secure random;;Java;[]
github.com;openrewrite/rewrite-java-security;main;GITHUB;https://github.com/openrewrite/rewrite-java-security/blob/main;Partial path traversal vulnerability;;Java;[]
github.com;openrewrite/rewrite-java-security;main;GITHUB;https://github.com/openrewrite/rewrite-java-security/blob/main;Prevent clickjacking;The `frame-ancestors` directive can be used in a Content-Security-Policy HTTP response header to indicate whether or not a browser should be allowed to render a page in a `<frame>` or `<iframe>`. Sites can use this to avoid Clickjacking attacks by ensuring that their content is not embedded into other sites.;Java;"[{""name"":""onlyIfSecurityConfig"",""displayName"":""Only if security configuration exists"",""description"":""Only patch existing implementations of `WebSecurityConfigurerAdapter`."",""required"":false}]"
github.com;openrewrite/rewrite-java-security;main;GITHUB;https://github.com/openrewrite/rewrite-java-security/blob/main;Enable CSRF attack prevention;Cross-Site Request Forgery (CSRF) is a type of attack that occurs when a malicious web site, email, blog, instant message, or program causes a user's web browser to perform an unwanted action on a trusted site when the user is authenticated. See the full [OWASP cheatsheet](https://cheatsheetseries.owasp.org/cheatsheets/Cross-Site_Request_Forgery_Prevention_Cheat_Sheet.html).;Java;"[{""name"":""onlyIfSecurityConfig"",""displayName"":""Only if security configuration exists"",""description"":""Only patch existing implementations of `WebSecurityConfigurerAdapter`."",""required"":false}]"
github.com;openrewrite/rewrite-java-security;main;GITHUB;https://github.com/openrewrite/rewrite-java-security/blob/main;Secure Spring service exporters;;Java;[]
github.com;openrewrite/rewrite-java-security;main;GITHUB;https://github.com/openrewrite/rewrite-java-security/blob/main;Find text-direction changes;;Java;[]
github.com;openrewrite/rewrite-java-security;main;GITHUB;https://github.com/openrewrite/rewrite-java-security/blob/main;SecureRandom seeds are not constant or predictable;Remove `SecureRandom#setSeed(*)` method invocations having constant or predictable arguments.;Java;[]
github.com;openrewrite/rewrite-java-security;main;GITHUB;https://github.com/openrewrite/rewrite-java-security/blob/main;Fix CWE-338 with `SecureRandom`;Use a cryptographically strong pseudo-random number generator (PRNG).;Java;[]
github.com;openrewrite/rewrite-java-security;main;GITHUB;https://github.com/openrewrite/rewrite-java-security/blob/main;Zip slip;;Java;[]
github.com;openrewrite/rewrite-java-security;main;GITHUB;https://github.com/openrewrite/rewrite-java-security/blob/main;Use secure temporary file creation;`java.io.File.createTempFile()` has exploitable default file permissions. This recipe migrates to the more secure `java.nio.file.Files.createTempFile()`.;Java;[]
github.com;openrewrite/rewrite-java-security;main;GITHUB;https://github.com/openrewrite/rewrite-java-security/blob/main;Improper privilege management;;Java;[]
github.com;openrewrite/rewrite-java-security;main;GITHUB;https://github.com/openrewrite/rewrite-java-security/blob/main;Use `Files#createTempDirectory`;Use `Files#createTempDirectory` when the sequence `File#createTempFile(..)`->`File#delete()`->`File#mkdir()` is used for creating a temp directory.;Java;[]
github.com;openrewrite/rewrite-java-security;main;GITHUB;https://github.com/openrewrite/rewrite-java-security/blob/main;Find secrets with regular expressions;A secret is a literal that matches any one of the provided patterns.;Java;"[{""name"":""secretName"",""displayName"":""Name"",""description"":""The type of secret that this recipe is looking for."",""example"":""AWS Access Key""},{""name"":""keyPattern"",""displayName"":""Key pattern"",""description"":""A regular expression to match a 'key' against. For example, a key "",""example"":""[a-zA-Z0-9+\\/=]{88}"",""required"":false},{""name"":""valuePattern"",""displayName"":""Value pattern"",""description"":""A regular expression to search for."",""example"":""[a-zA-Z0-9+\\/=]{88}""}]"
github.com;openrewrite/rewrite-java-security;main;GITHUB;https://github.com/openrewrite/rewrite-java-security/blob/main;Find Slack secrets;Locates Slack secrets stored in plain text in code.;Java;[]
github.com;openrewrite/rewrite-java-security;main;GITHUB;https://github.com/openrewrite/rewrite-java-security/blob/main;Find JWT secrets;Locates JWTs stored in plain text in code.;Java;[]
github.com;openrewrite/rewrite-java-security;main;GITHUB;https://github.com/openrewrite/rewrite-java-security/blob/main;Find sensitive API endpoints;;Java;"[{""name"":""fieldNames"",""displayName"":""Field names"",""description"":""Field names to search for."",""example"":""password,dateOfBirth,dob,ssn""},{""name"":""transitive"",""displayName"":""Transitive"",""required"":false}]"
github.com;openrewrite/rewrite-java-security;main;GITHUB;https://github.com/openrewrite/rewrite-java-security/blob/main;Secure the use of Jackson default typing;See the [blog post](https://cowtowncoder.medium.com/on-jackson-cves-dont-panic-here-is-what-you-need-to-know-54cd0d6e8062) on this subject.;Java;[]
github.com;openrewrite/rewrite-java-security;main;GITHUB;https://github.com/openrewrite/rewrite-java-security/blob/main;Insecure JMS deserialization;;Java;[]
github.com;openrewrite/rewrite-java-security;main;GITHUB;https://github.com/openrewrite/rewrite-java-security/blob/main;Secure the use of SnakeYAML's constructor;See the [paper](https://github.com/mbechler/marshalsec) on this subject.;Java;[]
github.com;openrewrite/rewrite-java-security;main;GITHUB;https://github.com/openrewrite/rewrite-java-security/blob/main;Regular Expression Denial of Service (ReDOS);;Java;[]
github.com;openrewrite/rewrite-java-security;main;GITHUB;https://github.com/openrewrite/rewrite-java-security/blob/main;XML parser XXE vulnerability;Avoid exposing dangerous features of the XML parser by updating certain factory settings.;Java;[]
github.com;openrewrite/rewrite-java-security;main;GITHUB;https://github.com/openrewrite/rewrite-java-security/blob/main;SecureTempFileCreation with filtering;Applies `SecureTempFileCreation` using `IsLikelyNotTest` and `SecureTempFileCreation` as applicability tests.;Java;[]
github.com;openrewrite/rewrite-javascript;main;GITHUB;https://github.com/openrewrite/rewrite-javascript/blob/main;JavaScript and TypeScript Spaces;Format whitespace in Java/Type Script code.;Java;[]
github.com;openrewrite/rewrite-javascript;main;GITHUB;https://github.com/openrewrite/rewrite-javascript/blob/main;Find JavaScript sources and collect data metrics;Use data table to collect source files types and counts of files with extensions `.js`, `.jsx`, `.mjs`, `.cjs`, `.ts`, `.tsx`, `.mts`, `.cts`.;Java;[]
github.com;openrewrite/rewrite-javascript;main;GITHUB;https://github.com/openrewrite/rewrite-javascript/blob/main;Replaces comma and logical OR operator with fall-through cases in switch statements;;Java;[]
github.com;openrewrite/rewrite-javascript;main;GITHUB;https://github.com/openrewrite/rewrite-javascript/blob/main;Add license header;Adds license headers to JavaScript source files when missing. Does not override existing license headers.;Java;"[{""name"":""licenseText"",""displayName"":""License text"",""description"":""The license header text without the block comment. May contain ${CURRENT_YEAR} property."",""example"":""Copyright ${CURRENT_YEAR} the original author or authors...""}]"
github.com;openrewrite/rewrite-jenkins;main;GITHUB;https://github.com/openrewrite/rewrite-jenkins/blob/main;Add or correct Jenkins plugins BOM;;Java;[]
github.com;openrewrite/rewrite-jenkins;main;GITHUB;https://github.com/openrewrite/rewrite-jenkins/blob/main;Is the project a Jenkins plugin?;Checks if the project is a Jenkins plugin by the presence of a managed version of jenkins-core;Java;"[{""name"":""version"",""displayName"":""Jenkins version"",""description"":""The value of the `<jenkins.version>` property."",""example"":""[1,)""}]"
github.com;openrewrite/rewrite-jenkins;main;GITHUB;https://github.com/openrewrite/rewrite-jenkins/blob/main;Upgrade property's value to version;If the current value is < given version, upgrade it.;Java;"[{""name"":""key"",""displayName"":""Key"",""description"":""The name of the property key to change."",""example"":""jenkins.version""},{""name"":""minimumVersion"",""displayName"":""Minimum version"",""description"":""Value to apply to the matching property if < this."",""example"":""2.375.1""}]"
github.com;openrewrite/rewrite-jenkins;main;GITHUB;https://github.com/openrewrite/rewrite-jenkins/blob/main;Upgrade jenkins java version;;Java;"[{""name"":""version"",""displayName"":""Java version"",""description"":""The Java version to upgrade to."",""example"":""17""},{""name"":""distribution"",""displayName"":""Distribution"",""description"":""The distribution of Java to use. When omitted the current distribution is maintained."",""example"":""openjdk""}]"
github.com;openrewrite/rewrite-jenkins;main;GITHUB;https://github.com/openrewrite/rewrite-jenkins/blob/main;Use Jenkins API plugin instead of libraries;Prefer Jenkins API plugins over bundling libraries for slimmer plugins.;Java;"[{""name"":""pluginGroupId"",""displayName"":""API Plugin's groupId"",""description"":""The first part of a dependency coordinate 'io.jenkins.plugins:ARTIFACT_ID:VERSION'."",""example"":""io.jenkins.plugins""},{""name"":""pluginArtifactId"",""displayName"":""API Plugin's artifactId"",""description"":""The second part of a dependency coordinate 'GROUP_ID:jackson2-api:VERSION'."",""example"":""jackson2-api""},{""name"":""pluginVersion"",""displayName"":""API Plugin's version"",""description"":""An exact version number."",""example"":""1981.v17df70e84a_a_1""},{""name"":""replaces"",""displayName"":""Replaced Libraries"",""description"":""The set of library coordinates replaced by this API Plugin."",""example"":""groupId: org.apache.commons\nartifactId: commons-text""}]"
github.com;openrewrite/rewrite-jenkins;main;GITHUB;https://github.com/openrewrite/rewrite-jenkins/blob/main;Create `index.jelly` if it doesn't exist;;Java;[]
github.com;openrewrite/rewrite-jenkins;main;GITHUB;https://github.com/openrewrite/rewrite-jenkins/blob/main;Disables local file resolution for parent POM;;Java;[]
github.com;openrewrite/rewrite-jenkins;main;GITHUB;https://github.com/openrewrite/rewrite-jenkins/blob/main;Add plugin developer team to CODEOWNERS;Adds the `{artifactId}-plugin-developers` team to all files in `.github/CODEOWNERS` if absent.;Java;[]
github.com;openrewrite/rewrite-jenkins;main;GITHUB;https://github.com/openrewrite/rewrite-jenkins/blob/main;Add XML declaration to Jelly files;Ensure the XML declaration `<?jelly escape-by-default='true'?>` is present in all `.jelly` files.;Java;[]
github.com;openrewrite/rewrite-kotlin;main;GITHUB;https://github.com/openrewrite/rewrite-kotlin/blob/main;Format Kotlin code;Format Kotlin code using a standard comprehensive set of Kotlin formatting recipes.;Java;[]
github.com;openrewrite/rewrite-kotlin;main;GITHUB;https://github.com/openrewrite/rewrite-kotlin/blob/main;Find Kotlin sources and collect data metrics;Use data table to collect source files types and counts of files with extensions `.kt`.;Java;"[{""name"":""markCompilationUnits"",""displayName"":""Find Kotlin compilation units"",""description"":""Limit the search results to Kotlin CompilationUnits."",""required"":false}]"
github.com;openrewrite/rewrite-kotlin;main;GITHUB;https://github.com/openrewrite/rewrite-kotlin/blob/main;Rename type alias;Change the name of a given type alias.;Java;"[{""name"":""aliasName"",""displayName"":""Old alias name"",""description"":""Name of the alias type."",""example"":""OldAlias""},{""name"":""newName"",""displayName"":""New alias name"",""description"":""Name of the alias type."",""example"":""NewAlias""},{""name"":""fullyQualifiedAliasedType"",""displayName"":""Target fully qualified type"",""description"":""Fully-qualified class name of the aliased type."",""example"":""org.junit.Assume""}]"
github.com;openrewrite/rewrite-kotlin;main;GITHUB;https://github.com/openrewrite/rewrite-kotlin/blob/main;Replace `Char#toInt()` with `Char#code`;;Java;[]
github.com;openrewrite/rewrite-kotlin;main;GITHUB;https://github.com/openrewrite/rewrite-kotlin/blob/main;Remove unnecessary parentheses on Kotlin types;In Kotlin, it's possible to add redundant nested parentheses in type definitions. This recipe is designed to remove those unnecessary parentheses.;Java;[]
github.com;openrewrite/rewrite-kotlin;main;GITHUB;https://github.com/openrewrite/rewrite-kotlin/blob/main;Structural equality tests should use `==` or `!=`;;Java;[]
github.com;openrewrite/rewrite-kotlin;main;GITHUB;https://github.com/openrewrite/rewrite-kotlin/blob/main;`it` shouldn't be used as a lambda parameter name;;Java;[]
github.com;openrewrite/rewrite-kotlin;main;GITHUB;https://github.com/openrewrite/rewrite-kotlin/blob/main;Remove unnecessary trailing semicolon;;Java;[]
github.com;openrewrite/rewrite-kotlin;main;GITHUB;https://github.com/openrewrite/rewrite-kotlin/blob/main;Remove trailing comma in Kotlin;Remove trailing commas in variable, parameter, and class property lists.;Java;[]
