repositoryOrigin;repositoryPath;repositoryBranch;scmType;repositoryLink;displayName;description;recipeType;options
github.com;openrewrite/rewrite;main;GITHUB;https://github.com/openrewrite/rewrite/blob/main;Stylize Groovy code to omit parentheses;Omit parentheses for last argument lambdas in Groovy code.;Java;[]
github.com;openrewrite/rewrite;main;GITHUB;https://github.com/openrewrite/rewrite/blob/main;Format Groovy code;Format Groovy code using a standard comprehensive set of Groovy formatting recipes.;Java;[]
github.com;openrewrite/rewrite;main;GITHUB;https://github.com/openrewrite/rewrite/blob/main;Move a closure which is the last argument of a method invocation out of parentheses;Groovy allows a shorthand syntax that allows a closure to be placed outside of parentheses.;Java;[]
github.com;openrewrite/rewrite;main;GITHUB;https://github.com/openrewrite/rewrite/blob/main;Groovy GString curly braces;;Java;[]
github.com;openrewrite/rewrite;main;GITHUB;https://github.com/openrewrite/rewrite/blob/main;Find instances of type `Quark`;`Quark` source files are pointers to the existence of a file without capturing any of the contents of the file.;Java;[]
github.com;openrewrite/rewrite;main;GITHUB;https://github.com/openrewrite/rewrite/blob/main;Rename a file;Rename a file while keeping it in the same directory.;Java;"[{""name"":""fileMatcher"",""displayName"":""File matcher"",""description"":""Matching files will be renamed. This is a glob expression."",""example"":""**/application-*.yml""},{""name"":""fileName"",""displayName"":""The renamed file name"",""description"":""Just the file name without the folder path that precedes it."",""example"":""application.yml""}]"
github.com;openrewrite/rewrite;main;GITHUB;https://github.com/openrewrite/rewrite/blob/main;Find source files with `ParseExceptionResult` markers;;Java;"[{""name"":""maxSnippetLength"",""displayName"":""Max snippet length"",""required"":false},{""name"":""parserType"",""displayName"":""Parser type"",""description"":""Only display failures from parsers with this simple name."",""required"":false,""example"":""YamlParser""},{""name"":""stackTrace"",""example"":""RuntimeException"",""displayName"":""Stack trace"",""description"":""Only mark stack traces with a message containing this text."",""required"":false}]"
github.com;openrewrite/rewrite;main;GITHUB;https://github.com/openrewrite/rewrite/blob/main;Is in repository;;Java;"[{""name"":""allowedRepositories"",""displayName"":""Allowed repositories"",""example"":""rewrite""}]"
github.com;openrewrite/rewrite;main;GITHUB;https://github.com/openrewrite/rewrite/blob/main;Find deserialization errors;Produces a data table collecting all deserialization errors of serialized LSTs.;Java;[]
github.com;openrewrite/rewrite;main;GITHUB;https://github.com/openrewrite/rewrite/blob/main;End of Line @ End of File (EOL @ EOF);;Java;[]
github.com;openrewrite/rewrite;main;GITHUB;https://github.com/openrewrite/rewrite/blob/main;Change text;;Java;"[{""name"":""toText"",""displayName"":""Text after change"",""description"":""The text file will have only this text after the change. The snippet provided here can be multiline."",""example"":""Some text.""}]"
github.com;openrewrite/rewrite;main;GITHUB;https://github.com/openrewrite/rewrite/blob/main;Append to text file;;Java;"[{""name"":""relativeFileName"",""displayName"":""Relative File Name"",""description"":""File name, using a relative path. If a non-plaintext file already exists at this location, then this recipe will do nothing."",""example"":""foo/bar/baz.txt""},{""name"":""content"",""displayName"":""Content"",""description"":""Multiline text content to be appended to the file."",""example"":""Some text.""},{""name"":""preamble"",""displayName"":""Preamble"",""description"":""If a new file is created, this content will be included at the beginning."",""example"":""# File generated by OpenRewrite #"",""required"":false},{""name"":""appendNewline"",""displayName"":""Append newline"",""description"":""Print a newline automatically after the content (and preamble). Default true."",""required"":false},{""name"":""existingFileStrategy"",""displayName"":""Existing file strategy"",""valid"":[""Continue"",""Replace"",""Leave""],""required"":false}]"
github.com;openrewrite/rewrite;main;GITHUB;https://github.com/openrewrite/rewrite/blob/main;Find text;Textual search, optionally using Regular Expression (regex) to query.;Java;"[{""name"":""find"",""displayName"":""Find"",""description"":""The text to find. This snippet can be multiline."",""example"":""blacklist""},{""name"":""regex"",""displayName"":""Regex"",""description"":""If true, `find` will be interpreted as a [Regular Expression](https://en.wikipedia.org/wiki/Regular_expression). Default `false`."",""required"":false},{""name"":""caseSensitive"",""displayName"":""Case sensitive"",""description"":""If `true` the search will be sensitive to case. Default `false`."",""required"":false},{""name"":""multiline"",""displayName"":""Regex multiline mode"",""required"":false},{""name"":""dotAll"",""displayName"":""Regex dot all"",""required"":false},{""name"":""filePattern"",""displayName"":""File pattern"",""required"":false,""example"":""**/*.java""}]"
github.com;openrewrite/rewrite;main;GITHUB;https://github.com/openrewrite/rewrite/blob/main;Create text file;Creates a new plain text file.;Java;"[{""name"":""fileContents"",""displayName"":""File contents"",""description"":""Multiline text content for the file."",""example"":""Some text.""},{""name"":""relativeFileName"",""displayName"":""Relative file path"",""description"":""File path of new file."",""example"":""foo/bar/baz.txt""},{""name"":""overwriteExisting"",""displayName"":""Overwrite existing file"",""description"":""If there is an existing file, should it be overwritten."",""required"":false}]"
github.com;openrewrite/rewrite;main;GITHUB;https://github.com/openrewrite/rewrite/blob/main;Experimental find text with multiselect;;Java;"[{""name"":""find"",""displayName"":""Find"",""description"":""The text to find. This snippet can be multiline."",""example"":""blacklist""},{""name"":""regex"",""displayName"":""Regex"",""description"":""If true, `find` will be interpreted as a Regular Expression. Default `false`."",""required"":false},{""name"":""regexOptions"",""displayName"":""Regex options"",""valid"":[""Case-sensitive"",""Multiline"",""Dot all""],""required"":false},{""name"":""filePattern"",""displayName"":""File pattern"",""example"":""**/*.java""}]"
github.com;openrewrite/rewrite;main;GITHUB;https://github.com/openrewrite/rewrite/blob/main;Find and replace;;Java;"[{""name"":""find"",""displayName"":""Find"",""description"":""The text to find (and replace). This snippet can be multiline."",""example"":""blacklist""},{""name"":""replace"",""displayName"":""Replace"",""description"":""The replacement text for `find`. This snippet can be multiline."",""example"":""denylist"",""required"":false},{""name"":""regex"",""displayName"":""Regex"",""description"":""Default false. If true, `find` will be interpreted as a [Regular Expression](https://en.wikipedia.org/wiki/Regular_expression), and capture group contents will be available in `replace`."",""required"":false},{""name"":""caseSensitive"",""displayName"":""Case sensitive"",""description"":""If `true` the search will be sensitive to case. Default `false`."",""required"":false},{""name"":""multiline"",""displayName"":""Regex multiline mode"",""required"":false},{""name"":""dotAll"",""displayName"":""Regex dot all"",""required"":false},{""name"":""filePattern"",""displayName"":""File pattern"",""required"":false,""example"":""**/*.java""},{""name"":""plaintextOnly"",""displayName"":""Plaintext only"",""description"":""Only alter files that are parsed as plaintext to prevent language-specific LST information loss. Defaults to false."",""required"":false}]"
github.com;openrewrite/rewrite;main;GITHUB;https://github.com/openrewrite/rewrite/blob/main;Do nothing;Default no-op test, does nothing.;Java;[]
github.com;openrewrite/rewrite;main;GITHUB;https://github.com/openrewrite/rewrite/blob/main;;;Java;[]
github.com;openrewrite/rewrite;main;GITHUB;https://github.com/openrewrite/rewrite/blob/main;Remove ignoral of files or directories from .gitignore;;Java;"[{""name"":""paths"",""displayName"":""Paths"",""description"":""The paths to find and remove from the gitignore files."",""example"":""/folder/file.txt""}]"
github.com;openrewrite/rewrite;main;GITHUB;https://github.com/openrewrite/rewrite/blob/main;Show Git source control metadata;;Java;[]
github.com;openrewrite/rewrite;main;GITHUB;https://github.com/openrewrite/rewrite/blob/main;Find colliding source files;;Java;[]
github.com;openrewrite/rewrite;main;GITHUB;https://github.com/openrewrite/rewrite/blob/main;Set file permission attributes;Set a file's read, write and executable permission attributes.;Java;"[{""name"":""fileMatcher"",""displayName"":""File matcher"",""description"":""Permissions will be applied to matching files. This is a glob expression."",""example"":""**/gradlew.bat""},{""name"":""isReadable"",""displayName"":""Readable"",""description"":""File read permission.""},{""name"":""isWritable"",""displayName"":""Writable"",""description"":""File write permission.""},{""name"":""isExecutable"",""displayName"":""Executable"",""description"":""Files executable permission.""}]"
github.com;openrewrite/rewrite;main;GITHUB;https://github.com/openrewrite/rewrite/blob/main;Find files;Find files by source path.;Java;"[{""name"":""filePattern"",""displayName"":""File pattern"",""description"":""A glob expression representing a file path to search for (relative to the project root). Blank/null matches all."",""required"":false,""example"":"".github/workflows/*.yml""}]"
github.com;openrewrite/rewrite;main;GITHUB;https://github.com/openrewrite/rewrite/blob/main;Find LST provenance;Produces a data table showing what versions of OpenRewrite/Moderne tooling was used to produce a given LST.;Java;[]
github.com;openrewrite/rewrite;main;GITHUB;https://github.com/openrewrite/rewrite/blob/main;Find parse to print inequality;;Java;[]
github.com;openrewrite/rewrite;main;GITHUB;https://github.com/openrewrite/rewrite/blob/main;Find committers on repositories;List the committers on a repository.;Java;"[{""name"":""fromDate"",""displayName"":""From date"",""required"":false,""description"":""Optional. Take into account only commits since this date (inclusive). Default will be the entire history."",""example"":""2023-01-01""}]"
github.com;openrewrite/rewrite;main;GITHUB;https://github.com/openrewrite/rewrite/blob/main;Find build metadata;Find source files with matching build metadata.;Java;"[{""name"":""key"",""displayName"":""Build metadata key"",""description"":""The key to search for in the build metadata."",""example"":""lstFormatVersion""},{""name"":""value"",""displayName"":""Build metadata value"",""description"":""The value to search for in the build metadata."",""example"":""2""}]"
github.com;openrewrite/rewrite;main;GITHUB;https://github.com/openrewrite/rewrite/blob/main;Delete files;Delete files by source path.;Java;"[{""name"":""filePattern"",""displayName"":""File pattern"",""description"":""A glob expression representing a file path to delete (relative to the project root)."",""example"":"".github/workflows/*.yml""}]"
github.com;openrewrite/rewrite;main;GITHUB;https://github.com/openrewrite/rewrite/blob/main;List runtime classpath;A diagnostic utility which emits the runtime classpath to a data table.;Java;[]
github.com;openrewrite/rewrite;main;GITHUB;https://github.com/openrewrite/rewrite/blob/main;Change XML attribute of a specific resource version;Alters XML Attribute value within specified element of a specific resource versions.;Java;"[{""name"":""elementName"",""displayName"":""Element name"",""description"":""The name of the element whose attribute's value is to be changed. Interpreted as an XPath Expression."",""example"":""property"",""required"":false},{""name"":""oldValue"",""displayName"":""Old value"",""description"":""Only change the property value if it matches the configured `oldValue`."",""example"":""newfoo.bar.attribute.value.string"",""required"":false},{""name"":""newValue"",""displayName"":""New value"",""description"":""The new value to be used for the namespace."",""example"":""newfoo.bar.attribute.value.string""},{""name"":""versionMatcher"",""displayName"":""Resource version"",""description"":""The version of resource to change"",""example"":""1.1"",""required"":false},{""name"":""searchAllNamespaces"",""displayName"":""Search all namespaces"",""description"":""Specify whether evaluate all namespaces. Defaults to true"",""example"":""true"",""required"":false},{""name"":""newVersion"",""displayName"":""New Resource version"",""description"":""The new version of the resource"",""example"":""2.0""},{""name"":""newSchemaLocation"",""displayName"":""Schema location"",""description"":""The new value to be used for the namespace schema location."",""example"":""newfoo.bar.attribute.value.string"",""required"":false}]"
github.com;openrewrite/rewrite;main;GITHUB;https://github.com/openrewrite/rewrite/blob/main;Normalize format;Move whitespace to the outermost LST element possible.;Java;[]
github.com;openrewrite/rewrite;main;GITHUB;https://github.com/openrewrite/rewrite/blob/main;Format XML;Indents XML using the most common indentation size and tabs or space choice in use in the file.;Java;[]
github.com;openrewrite/rewrite;main;GITHUB;https://github.com/openrewrite/rewrite/blob/main;Blank lines;Add line breaks at appropriate places between XML syntax elements.;Java;[]
github.com;openrewrite/rewrite;main;GITHUB;https://github.com/openrewrite/rewrite/blob/main;Normalize line breaks;;Java;[]
github.com;openrewrite/rewrite;main;GITHUB;https://github.com/openrewrite/rewrite/blob/main;Tabs and indents;Format tabs and indents in XML code.;Java;[]
github.com;openrewrite/rewrite;main;GITHUB;https://github.com/openrewrite/rewrite/blob/main;Normalize to tabs or spaces;Consistently use either tabs or spaces in indentation.;Java;[]
github.com;openrewrite/rewrite;main;GITHUB;https://github.com/openrewrite/rewrite/blob/main;Remove empty XML Tag;Removes XML tags that do not have attributes or children, including self closing tags.;Java;[]
github.com;openrewrite/rewrite;main;GITHUB;https://github.com/openrewrite/rewrite/blob/main;Create XML file;Create a new XML file.;Java;"[{""name"":""relativeFileName"",""displayName"":""Relative file path"",""description"":""File path of new file."",""example"":""foo/bar/baz.xml""},{""name"":""fileContents"",""displayName"":""File contents"",""description"":""Multiline text content for the file."",""required"":false},{""name"":""overwriteExisting"",""displayName"":""Overwrite existing file"",""description"":""If there is an existing file, should it be overwritten."",""required"":false}]"
github.com;openrewrite/rewrite;main;GITHUB;https://github.com/openrewrite/rewrite/blob/main;Remove XML tag;Removes XML tags matching the provided expression.;Java;"[{""name"":""xPath"",""displayName"":""XPath"",""description"":""An XPath expression used to find matching tags."",""example"":""/project/dependencies/dependency""},{""name"":""fileMatcher"",""displayName"":""File matcher"",""description"":""If provided only matching files will be modified. This is a glob expression."",""required"":false,""example"":""'**/application-*.xml'""}]"
github.com;openrewrite/rewrite;main;GITHUB;https://github.com/openrewrite/rewrite/blob/main;XML style Auto-detection debug;;Java;[]
github.com;openrewrite/rewrite;main;GITHUB;https://github.com/openrewrite/rewrite/blob/main;Change XML tag name;Alters the name of XML tags matching the provided expression.;Java;"[{""name"":""elementName"",""displayName"":""Element name"",""description"":""The name of the element whose attribute's value is to be changed. Interpreted as an XPath expression."",""example"":""/settings/servers/server/username""},{""name"":""newName"",""displayName"":""New name"",""description"":""The new name for the tag."",""example"":""user""}]"
github.com;openrewrite/rewrite;main;GITHUB;https://github.com/openrewrite/rewrite/blob/main;Update OWASP suppression date bounds;;Java;"[{""name"":""cveList"",""displayName"":""CVE List"",""description"":""Update suppressions having any of the specified CVE tags."",""example"":""CVE-2022-1234""},{""name"":""untilDate"",""displayName"":""Until date"",""required"":false,""description"":""Optional. The date to add to the suppression. Default will be 30 days from today."",""example"":""2023-01-01""}]"
github.com;openrewrite/rewrite;main;GITHUB;https://github.com/openrewrite/rewrite/blob/main;Remove out-of-date OWASP suppressions;;Java;[]
github.com;openrewrite/rewrite;main;GITHUB;https://github.com/openrewrite/rewrite/blob/main;Find OWASP vulnerability suppression XML files;These files are used to suppress false positives in OWASP [Dependency Check](https://jeremylong.github.io/DependencyCheck).;Java;[]
github.com;openrewrite/rewrite;main;GITHUB;https://github.com/openrewrite/rewrite/blob/main;Add date bounds to OWASP suppressions;;Java;"[{""name"":""untilDate"",""displayName"":""Until date"",""required"":false,""description"":""Optional. The date to add to the suppression. Default will be 30 days from today."",""example"":""2023-01-01""}]"
github.com;openrewrite/rewrite;main;GITHUB;https://github.com/openrewrite/rewrite/blob/main;Remove trailing whitespace;Remove any extra trailing whitespace from the end of each line.;Java;[]
github.com;openrewrite/rewrite;main;GITHUB;https://github.com/openrewrite/rewrite/blob/main;Change XML attribute;Alters XML attribute value on a specified element.;Java;"[{""name"":""elementName"",""displayName"":""Element name"",""description"":""The name of the element whose attribute's value is to be changed. Interpreted as an XPath expression."",""example"":""property""},{""name"":""attributeName"",""displayName"":""Attribute name"",""description"":""The name of the attribute whose value is to be changed."",""example"":""name""},{""name"":""newValue"",""displayName"":""New value"",""description"":""The new value to be used for key specified by `attributeName`, Set to null if you want to remove the attribute."",""example"":""newfoo.bar.attribute.value.string""},{""name"":""oldValue"",""displayName"":""Old value"",""example"":""foo.bar.attribute.value.string"",""required"":false,""description"":""Only change the property value if it matches the configured `oldValue`.""},{""name"":""regex"",""displayName"":""Regex"",""description"":""Default false. If true, `oldValue` will be interpreted as a Regular Expression, and capture group contents will be available in `newValue`."",""required"":false}]"
github.com;openrewrite/rewrite;main;GITHUB;https://github.com/openrewrite/rewrite/blob/main;Add or update child tag;;Java;"[{""name"":""parentXPath"",""displayName"":""Parent XPath"",""description"":""XPath identifying the parent to which a child tag must be added"",""example"":""/project//plugin//configuration""},{""name"":""newChildTag"",""displayName"":""New child tag"",""description"":""The XML of the new child to add or update on the parent tag."",""example"":""<skip>true</skip>""},{""name"":""replaceExisting"",""displayName"":""Replace existing child"",""description"":""Set to `false` to not replace the child tag if it already exists. Defaults to true."",""required"":false}]"
github.com;openrewrite/rewrite;main;GITHUB;https://github.com/openrewrite/rewrite/blob/main;Change XML tag value;Alters the value of XML tags matching the provided expression.;Java;"[{""name"":""elementName"",""displayName"":""Element name"",""description"":""The name of the element whose value is to be changed. Interpreted as an XPath Expression."",""example"":""/settings/servers/server/username""},{""name"":""oldValue"",""displayName"":""Old value"",""description"":""The old value of the tag."",""required"":false,""example"":""user""},{""name"":""newValue"",""displayName"":""New value"",""description"":""The new value for the tag."",""example"":""user""}]"
github.com;openrewrite/rewrite;main;GITHUB;https://github.com/openrewrite/rewrite/blob/main;Find XML tags;Find XML tags by XPath expression.;Java;"[{""name"":""xPath"",""displayName"":""XPath"",""description"":""An XPath expression used to find matching tags."",""example"":""//dependencies/dependency""}]"
github.com;openrewrite/rewrite;main;GITHUB;https://github.com/openrewrite/rewrite/blob/main;Find XML namespace prefixes;Find XML namespace prefixes, optionally restricting the search by a XPath expression.;Java;"[{""name"":""namespacePrefix"",""displayName"":""Namespace prefix"",""description"":""The Namespace Prefix to find."",""example"":""http://www.w3.org/2001/XMLSchema-instance""},{""name"":""xPath"",""displayName"":""XPath"",""description"":""An XPath expression used to find namespace URIs."",""example"":""/dependencies/dependency"",""required"":false}]"
github.com;openrewrite/rewrite;main;GITHUB;https://github.com/openrewrite/rewrite/blob/main;Find XML namespace URIs;Find XML namespace URIs, optionally restricting the search by a XPath expression.;Java;"[{""name"":""namespaceUri"",""displayName"":""Namespace URI"",""description"":""The Namespace URI to find."",""example"":""http://www.w3.org/2001/XMLSchema-instance""},{""name"":""xPath"",""displayName"":""XPath"",""description"":""An XPath expression used to find namespace URIs."",""example"":""/dependencies/dependency"",""required"":false}]"
github.com;openrewrite/rewrite;main;GITHUB;https://github.com/openrewrite/rewrite/blob/main;Add a comment to an XML tag;Adds a comment as the first element in an XML tag.;Java;"[{""name"":""xPath"",""displayName"":""XPath"",""description"":""An XPath expression used to find matching tags."",""example"":""/project/dependencies/dependency""},{""name"":""commentText"",""displayName"":""Comment text"",""description"":""The text to add as a comment.."",""example"":""This is excluded due to CVE <X> and will be removed when we upgrade the next version is available.""}]"
github.com;openrewrite/rewrite;main;GITHUB;https://github.com/openrewrite/rewrite/blob/main;XSLT transformation;;Java;"[{""name"":""xslt"",""displayName"":""XSLT Configuration transformation"",""description"":""The transformation to be applied."",""example"":""<xsl:stylesheet ...>...</xsl:stylesheet>"",""required"":false},{""name"":""xsltResource"",""displayName"":""XSLT Configuration transformation classpath resource"",""description"":""Recipe transformation provided as a classpath resource."",""example"":""/changePlugin.xslt"",""required"":false},{""name"":""filePattern"",""displayName"":""File pattern"",""example"":""**/*.xml""}]"
github.com;openrewrite/rewrite;main;GITHUB;https://github.com/openrewrite/rewrite/blob/main;Verify cursor well-formed;This recipe verifies that the cursor is well-formed.;Java;[]
github.com;openrewrite/rewrite;main;GITHUB;https://github.com/openrewrite/rewrite/blob/main;Mixed constructor;A recipe with more than one constructor, with one marked as the primary.;Java;[]
github.com;openrewrite/rewrite;main;GITHUB;https://github.com/openrewrite/rewrite/blob/main;Finalize local variables;Adds the `final` modifier keyword to local variables which are not reassigned.;Java;[]
github.com;openrewrite/rewrite;main;GITHUB;https://github.com/openrewrite/rewrite/blob/main;Extract interface;Extract to an interface named `ITest`.;Java;[]
github.com;openrewrite/rewrite;main;GITHUB;https://github.com/openrewrite/rewrite/blob/main;;An ad hoc recipe used in RewriteTest.;Java;[]
github.com;openrewrite/rewrite;main;GITHUB;https://github.com/openrewrite/rewrite/blob/main;;An ad hoc recipe used in RewriteTest.;Java;[]
github.com;openrewrite/rewrite;main;GITHUB;https://github.com/openrewrite/rewrite/blob/main;Uses cursor improperly;LST elements are acyclic. So a cursor which indicates an element is its own parent is invalid.;Java;[]
github.com;openrewrite/rewrite;main;GITHUB;https://github.com/openrewrite/rewrite/blob/main;Creates two source files with the same path;;Java;[]
github.com;openrewrite/rewrite;main;GITHUB;https://github.com/openrewrite/rewrite/blob/main;Recipe with name option;A fancy description.;Java;"[{""name"":""name""}]"
github.com;openrewrite/rewrite;main;GITHUB;https://github.com/openrewrite/rewrite/blob/main;Recipe with name option;"A fancy description.
For more information, see:
  - [link 1](https://example.com/link1)
  - [link 2](https://example.com/link2)";Java;"[{""name"":""name""}]"
github.com;openrewrite/rewrite;main;GITHUB;https://github.com/openrewrite/rewrite/blob/main;Recipe with name option;"A fancy description.
For more information, see:
  - First Resource [link 1](https://example.com/link1).
  - Second Resource [link 2](https://example.com/link2).";Java;"[{""name"":""name""}]"
github.com;openrewrite/rewrite;main;GITHUB;https://github.com/openrewrite/rewrite/blob/main;Recipe with name option;A fancy description;Java;"[{""name"":""name""}]"
github.com;openrewrite/rewrite;main;GITHUB;https://github.com/openrewrite/rewrite/blob/main;Test recipe;Test recipe.;Java;"[{""name"":""theOption"",""displayName"":""An option"",""description"":""A sample option."",""example"":""Some text.""}]"
github.com;openrewrite/rewrite;main;GITHUB;https://github.com/openrewrite/rewrite/blob/main;Recipe with no parameters;A recipe with no parameters, used in EnvironmentTest;Java;[]
github.com;openrewrite/rewrite;main;GITHUB;https://github.com/openrewrite/rewrite/blob/main;Recipe accepting parameters;A recipe with parameters, used in EnvironmentTest;Java;"[{""name"":""foo"",""example"":""someString"",""displayName"":""foo""},{""name"":""bar"",""displayName"":""bar""}]"
